{
  "$schema": "https://json-schema.org/draft/2020-12/schema",
  "$id": "https://worldforge.local/schemas/worldrecipe-1.schema.json",
  "title": "WorldRecipe (format 1, W0 vocabulary)",
  "description": "Author-facing root generation document. Mirrors src/recipe/validate.ts, which is the enforced validator. Vocabulary through behavior 36: seed, named presets (size/climate/density), integer permille biases, budgets, toggles (none defined), decoration density, landmark requests with relational constraints or authored pins (at / near), per-recipe authored stamps, and sparse cell overrides. Remaining named-entity fields stay rejected until their milestones.",
  "type": "object",
  "additionalProperties": false,
  "required": [
    "recipeFormat",
    "seed",
    "world"
  ],
  "properties": {
    "recipeFormat": {
      "const": 1
    },
    "seed": {
      "type": "integer",
      "minimum": 0,
      "maximum": 4294967295
    },
    "world": {
      "type": "object",
      "additionalProperties": false,
      "required": [
        "sizePreset",
        "climatePreset"
      ],
      "properties": {
        "sizePreset": {
          "enum": [
            "tiny",
            "small"
          ]
        },
        "climatePreset": {
          "enum": [
            "temperate",
            "cold_coastal"
          ]
        },
        "densityPreset": {
          "enum": [
            "sparse",
            "balanced",
            "dense"
          ]
        }
      }
    },
    "biases": {
      "type": "object",
      "additionalProperties": false,
      "properties": {
        "northElevationPermille": {
          "type": "integer",
          "minimum": -1000,
          "maximum": 1000
        },
        "temperaturePermille": {
          "type": "integer",
          "minimum": -1000,
          "maximum": 1000
        },
        "moisturePermille": {
          "type": "integer",
          "minimum": -1000,
          "maximum": 1000
        }
      }
    },
    "budgets": {
      "type": "object",
      "additionalProperties": false,
      "properties": {
        "regionCount": {
          "type": "integer",
          "minimum": 1,
          "maximum": 16
        },
        "settlementCount": {
          "type": "integer",
          "minimum": 0,
          "maximum": 16
        },
        "primaryRouteCount": {
          "type": "integer",
          "minimum": 0,
          "maximum": 8
        },
        "landmarkCount": {
          "type": "integer",
          "minimum": 0,
          "maximum": 8
        }
      }
    },
    "toggles": {
      "type": "object",
      "additionalProperties": false,
      "properties": {}
    },
    "landmarks": {
      "type": "array",
      "maxItems": 12,
      "items": {
        "type": "object",
        "additionalProperties": false,
        "required": [
          "type"
        ],
        "properties": {
          "type": {
            "anyOf": [
              {
                "enum": [
                  "ancient_fortress",
                  "ruined_city",
                  "world_tree",
                  "crystal_spire",
                  "lighthouse",
                  "hunters_lodge",
                  "mountain_hamlet"
                ]
              },
              {
                "type": "string",
                "pattern": "^recipe\\.[a-z][a-z0-9-]*$",
                "description": "a declared authoredStamps entry, namespaced recipe.<name>"
              }
            ]
          },
          "relation": {
            "enum": [
              "across_river_from_town",
              "near_town",
              "far_from_town",
              "high_ground",
              "coastal",
              "remote_corner"
            ]
          },
          "at": {
            "type": "array",
            "minItems": 2,
            "maxItems": 2,
            "items": {
              "type": "integer",
              "minimum": 0
            },
            "description": "pinned anchor cell; mutually exclusive with relation and near; fails generation with a named error rather than relocating"
          },
          "near": {
            "type": "object",
            "additionalProperties": false,
            "required": [
              "cell",
              "radius"
            ],
            "properties": {
              "cell": {
                "type": "array",
                "minItems": 2,
                "maxItems": 2,
                "items": {
                  "type": "integer",
                  "minimum": 0
                },
                "description": "[x, y] cell; must lie inside the size preset's world"
              },
              "radius": {
                "type": "integer",
                "minimum": 1,
                "maximum": 64
              }
            },
            "description": "constrained anchor search; mutually exclusive with relation and at"
          }
        }
      }
    },
    "settlements": {
      "type": "array",
      "maxItems": 32,
      "description": "settlement constraints (behaviors 37-38): each entry claims one budget rank (explicit rank field, else its entry index) and places it by at or near; rank 0 is the capital; unclaimed ranks stay free-competed",
      "items": {
        "type": "object",
        "additionalProperties": false,
        "properties": {
          "at": {
            "type": "array",
            "minItems": 2,
            "maxItems": 2,
            "items": {
              "type": "integer",
              "minimum": 0
            },
            "description": "pinned anchor cell; mutually exclusive with near; fails generation with a named error rather than relocating"
          },
          "near": {
            "type": "object",
            "additionalProperties": false,
            "required": [
              "cell",
              "radius"
            ],
            "properties": {
              "cell": {
                "type": "array",
                "minItems": 2,
                "maxItems": 2,
                "items": {
                  "type": "integer",
                  "minimum": 0
                },
                "description": "[x, y] cell; must lie inside the size preset's world"
              },
              "radius": {
                "type": "integer",
                "minimum": 1,
                "maximum": 64
              }
            },
            "description": "constrained anchor search; mutually exclusive with at"
          },
          "rank": {
            "type": "integer",
            "minimum": 0,
            "maximum": 31,
            "description": "explicit budget-slot claim (behavior 38); defaults to the entry index; effective ranks must be unique and below budgets.settlementCount"
          }
        }
      }
    },
    "zones": {
      "type": "object",
      "additionalProperties": false,
      "required": [
        "seams",
        "entries"
      ],
      "description": "zone composition (behavior 43): a grid of climate zones, each an additive character offset on the world climate; sea level stays a world choice",
      "properties": {
        "grid": {
          "type": "array",
          "minItems": 2,
          "maxItems": 2,
          "items": {
            "type": "integer",
            "minimum": 1,
            "maximum": 8
          },
          "description": "[columns, rows]; required for grid layout, forbidden for anchors; world dimensions must divide evenly by each"
        },
        "seams": {
          "enum": [
            "blended",
            "hard"
          ],
          "description": "blended = climate gradient over the seam band; hard = sharp zone borders"
        },
        "entries": {
          "type": "array",
          "maxItems": 64,
          "items": {
            "type": "object",
            "additionalProperties": false,
            "properties": {
              "temperaturePermille": {
                "type": "integer",
                "minimum": -1000,
                "maximum": 1000
              },
              "moisturePermille": {
                "type": "integer",
                "minimum": -1000,
                "maximum": 1000
              },
              "anchor": {
                "type": "array",
                "minItems": 2,
                "maxItems": 2,
                "items": {
                  "type": "integer",
                  "minimum": 0
                },
                "description": "anchor cell [x, y]; required for anchors layout"
              },
              "weight": {
                "type": "integer",
                "minimum": 100,
                "maximum": 10000,
                "description": "territory weight (anchors layout); bigger claims more land; default 1000"
              },
              "elevationPermille": {
                "type": "integer",
                "minimum": -1000,
                "maximum": 1000,
                "description": "elevation character (behavior 46): strongly negative drowns the zone into sea; always blended at borders so coasts shelve"
              }
            }
          },
          "description": "one entry per zone in reading order (NW to SE); length must equal columns*rows"
        },
        "layout": {
          "enum": [
            "grid",
            "anchors"
          ],
          "description": "grid (default): uniform tiling; anchors: weighted territories around authored anchor cells (behavior 45)"
        }
      }
    },
    "settlementStyle": {
      "type": "object",
      "additionalProperties": false,
      "description": "settlement organics + variety (behavior 49): opt-in per-settlement size growth, center-to-rim scatter falloff, and purpose-flavored building mixes; absent means pre-49 fabric byte-for-byte",
      "properties": {
        "growthPermille": {
          "type": "integer",
          "minimum": 0,
          "maximum": 1000,
          "description": "max extra settlement radius as a permille of base, rolled per settlement (squared roll; cities full, towns half, outposts never); lots and approach budgets scale with the grown area"
        },
        "scatterPermille": {
          "type": "integer",
          "minimum": 0,
          "maximum": 900,
          "description": "structure acceptance falls linearly from the plaza to 1000-scatterPermille at the rim, and the fabric footprint extends by the same fraction; civic specials always place"
        },
        "variety": {
          "type": "boolean",
          "description": "purpose-flavored specials and fill from the expanded roster: warehouses/fisher huts (harbor), quarries (mining), windmills (farming), watermills (crossing), stores/guardhouses/tents"
        }
      }
    },
    "decoration": {
      "type": "object",
      "additionalProperties": false,
      "properties": {
        "densityPermille": {
          "type": "integer",
          "minimum": 0,
          "maximum": 1000
        }
      }
    },
    "authoredStamps": {
      "type": "array",
      "description": "One-off per-recipe stamps (behavior 36). Each stamp is a full stampFormat-1 definition whose type must be recipe.<name>; it passes exactly the fixture library's parser checks.",
      "items": {
        "type": "object",
        "additionalProperties": false,
        "required": [
          "name",
          "stamp"
        ],
        "properties": {
          "name": {
            "type": "string",
            "pattern": "^[a-z][a-z0-9-]*$"
          },
          "stamp": {
            "type": "object"
          }
        }
      }
    },
    "cellOverrides": {
      "type": "array",
      "description": "Sparse designer spot decisions (behavior 36), applied after every procedural pass and before validation. At least one of material/clearProp/clearDecal per entry; water materials refused (hydrology owns water); duplicate cells refused; soft cap 64 (warn-only).",
      "items": {
        "type": "object",
        "additionalProperties": false,
        "required": [
          "cell"
        ],
        "properties": {
          "cell": {
            "type": "array",
            "minItems": 2,
            "maxItems": 2,
            "items": {
              "type": "integer",
              "minimum": 0
            },
            "description": "[x, y] cell; must lie inside the size preset's world"
          },
          "material": {
            "type": "string",
            "description": "semantic palette key; never water.*"
          },
          "clearProp": {
            "const": true
          },
          "clearDecal": {
            "const": true
          }
        }
      }
    }
  }
}
