{
  "recipeFormat": 1,
  "seed": 77103,
  "world": { "sizePreset": "small", "climatePreset": "temperate", "densityPreset": "sparse" },
  "landmarks": [{ "type": "hunters_lodge", "relation": "remote_corner" }],
  "budgets": {
    "regionCount": 4,
    "settlementCount": 4,
    "primaryRouteCount": 1,
    "landmarkCount": 1
  }
}
