{
  "recipeFormat": 1,
  "seed": 103991,
  "world": { "sizePreset": "small", "climatePreset": "cold_coastal" },
  "biases": {
    "northElevationPermille": 350
  },
  "landmarks": [
    { "type": "ancient_fortress", "relation": "across_river_from_town" },
    { "type": "ruined_city", "relation": "high_ground" },
    { "type": "world_tree", "relation": "far_from_town" },
    { "type": "crystal_spire", "relation": "high_ground" },
    { "type": "lighthouse", "relation": "coastal" },
    { "type": "hunters_lodge", "relation": "remote_corner" }
  ],
  "budgets": {
    "regionCount": 4,
    "settlementCount": 10,
    "primaryRouteCount": 3,
    "landmarkCount": 6
  }
}
