{
  "recipeFormat": 1,
  "seed": 90210,
  "world": { "sizePreset": "small", "climatePreset": "cold_coastal", "densityPreset": "balanced" },
  "biases": {
    "northElevationPermille": 520,
    "temperaturePermille": -40
  },
  "landmarks": [
    { "type": "ancient_fortress", "relation": "high_ground" },
    { "type": "mountain_hamlet", "relation": "high_ground" },
    { "type": "mountain_hamlet", "relation": "high_ground" },
    { "type": "crystal_spire", "relation": "high_ground" },
    { "type": "hunters_lodge", "relation": "remote_corner" }
  ],
  "budgets": {
    "regionCount": 4,
    "settlementCount": 7,
    "primaryRouteCount": 2,
    "landmarkCount": 5
  }
}
